{
  "anchor": {
    "barycentric": [
      0.2,
      0.3,
      0.5
    ],
    "face_index": 1200,
    "topology_sha256": "e0ca7ee25dc0b4c8d841bb2626e364bb88b7af7fae037e30854728842e320a18"
  },
  "body_identity_sha256": "ed4b000260e5e5598ea00848b6f664a828a241e1791afa292e12b8db54d1a993",
  "content_sha256": "90837f9ffacc888d74a9afe3b3a89c02bd4203d54534505da275a8cb46fdb61c",
  "laterality": "left",
  "mirrored": false,
  "physical_scale_m": [
    0.08,
    0.05
  ],
  "provenance": {
    "created_utc": "2026-09-04T01:09:37Z",
    "producer": "tatbot-human-representation-fixture",
    "seed": 13,
    "source_sha256": "1480fb125459cbca6cff13fbac5d846220d91cf906e466eb2842ef350878138b",
    "version": "1"
  },
  "rest_surface_sha256": "caa66dff9b3625771c8f4c35bfe59556d30acdc3800880106f98f0ce75c49a95",
  "review": {
    "evidence_sha256": "02893a5d4d7228380dbaa7653d384aa2891a5ce510dc3f0e6c70468221416a2d",
    "reviewer": "maintainer-required",
    "status": "pending"
  },
  "rotation_rad": 0.15,
  "schema": "tatbot.surface-placement/1",
  "semantic_site": "synthetic-left-forearm",
  "supported_domain": {
    "face_indices": [
      1200,
      1201
    ],
    "margin_m": 0.003
  },
  "tangent_frame_rule": "projected-body-up-then-oriented-normal",
  "tattoo_program_sha256": "6e46984c4abc85cf6588524699edb588b1701d89bac4bfffc8f9e37e593f4e0b",
  "warp": null
}
